"Name"|"Artist"|"CCLI Number"|"Dates Used"
"10,000 Reasons (Bless The Lord)"|"Jonas Myrin, Matt Redman"|6016351|"Mär 26, 2022, Feb 27, 2022"
"Alle Augen auf dich"|"Daniel Harter, Mitch Schlüter, Tobi Wörner"|7096771|"Mai 8, 2022"
"Allein deine Gnade genügt"|"Ken Janz, Martin Nystrom, Martin Pepper"|5282557|"Apr 24, 2022"
"Alles was ich hab"|"Thomas Klein"|4866709|"Mär 26, 2022, Mär 13, 2022, Apr 17, 2022, Jan 23, 2022, Jan 16, 2022, Mai 22, 2022"
"Anker in der Zeit"|"Albert Frey"|4326005|"Mai 22, 2022"
